skill,skillName,eff
73,Covering Fire ,ทุก 20 (10) วินาที จะยิงกระสุนปืนใหญ่โจมตีโดยกระสุนสร้างความเสียหายได้เทียบเท่ากับกระสุนของเรือลาดตระเวนหนัก (ความเสียหายขึ้นอยู่กับเลเวลสกิล)
73,Fleet Carrier ,ทุกครั้งที่ส่งฝูงเครื่องบินออกไปด้วยคำสั่ง Airstrikeเพิ่มค่าพลังโจมตีปืนใหญ่ให้กับกองเรือแถวหน้าทั้งหมด 5.0% (15.0%) นาน 8 วินาที
74,Covering Fire ,ทุก 20 (10) วินาที จะยิงกระสุนปืนใหญ่โจมตีโดยกระสุนสร้างความเสียหายได้เทียบเท่ากับกระสุนของเรือลาดตระเวนหนัก (ความเสียหายขึ้นอยู่กับเลเวลสกิล)
74,Fleet Carrier ,ทุกครั้งที่ส่งฝูงเครื่องบินออกไปด้วยคำสั่ง Airstrikeเพิ่มค่าพลังโจมตีปืนใหญ่ให้กับกองเรือแถวหน้าทั้งหมด 5.0% (15.0%) นาน 8 วินาที
75,Fast Take-off ,เมื่อใช้คำสั่ง Airstrike มีโอกาส 5.0% (15.0%) ที่จะรีเซ็ทคูลดาวน์การส่งฝูงเครื่องบินรอบถัดไปให้เสร็จทันที
75,Raid Carrier  (ได้รับหลัง Remodel),ฝูงเครื่องบินที่ส่งออกไปโจมตีจากการใช้คำสั่ง Airstrike มีโอกาส 15.0% (25.0%) ที่จะสร้างความเสียหาย 2 เท่า
76,Vengeful Strike ,เมื่อพลังชีวิตต่ำกว่า 20.0% จะฟื้นฟูพลังชีวิตกลับคืนมา 15.0% (25.0%) และส่งฝูงเครื่องบินพิเศษจากสกิลเข้าจู่โจมศัตรูทันที (ความเสียหายขึ้นอยู่กับเลเวลสกิล)ทุก 1 การต่อสู้จะแสดงผลสกิลนีได้ครั้งเดียวเท่านั้น
76,Fleet Carrier ,ทุกครั้งที่ส่งฝูงเครื่องบินออกไปด้วยคำสั่ง Airstrikeเพิ่มค่าพลังโจมตีปืนใหญ่ให้กับกองเรือแถวหน้าทั้งหมด 5.0% (15.0%) นาน 8 วินาที
77,LuckyE,เมื่อใช้คำสั่ง Airstrikeมีโอกาส 40.0% (70.0%) ที่จะสร้างความเสียหายจากฝูงบินเหล่านั้น 2 เท่าและทำให้ตนเองได้รับสถานะอำพรางตัว มีผลหลบหลีกการโจมตีทุกชนิด นาน 8 วินาที
78,Doolittle Raid ,การจู่โจมด้วยฝูงบินมีโอกาส 20.0% (40.0%) ที่จะใช้ฝูงเครื่องบินทิ้งระเบิดแบบพิเศษ B25 เข้าจู่โจมเป็นระลอกเสริม 1 ครั้ง
78,Raid Carrier ,ฝูงเครื่องบินที่ส่งออกไปโจมตีจากการใช้คำสั่ง Airstrike มีโอกาส 15.0% (25.0%) ที่จะสร้างความเสียหาย 2 เท่า
144,Sally Swordfish ,การจู่โจมด้วยฝูงเครื่องบินจาก Airstrike จะส่งฝูงเครื่องบินตอร์ปิโดแบบพิเศษ Fairey Swordfish เข้าจู่โจมด้วยการทิ้งตอร์ปิโดเป็นระลอกเสริม 1 ครั้ง (สร้างความเสียหายตามเลเวลสกิล) และศัตรูที่โดนตอร์ปิโดชนจะถูกลดความเร็วเคลื่อนที่ลง 30.0% (60.0%) นาน 8 วินาที
144,Raid Carrier ,ฝูงเครื่องบินที่ส่งออกไปโจมตีจากการใช้คำสั่ง Airstrike มีโอกาส 15.0% (25.0%) ที่จะสร้างความเสียหาย 2 เท่า
145,Armored Carrier ,ทุกครั้งหลังใช้คำสั่ง Airstrikeเพิ่มบาเรียป้องกันกองเรือแถวหน้าบาเรียป้องกันความเสียหายได้เท่ากับ 5.0% (10.0%) ของพลังชีวิตตนเอง นาน 8 วินาที
224,Preemptive Victory  ,เมื่ออยู่ในช่วงโจมตีคูลดาวน์ของคำสั่ง Airstrike ในรอบแรกลดลง 20.0% (50.0%)
224,Ikkousen ,เมื่อมี Kaga อยู่ในกองเรือค่าพลังโจมตีทางอากาศของตนเองเพิ่มขึ้น 15.0% (30.0%)
225,Preemptive Victory  ,เมื่ออยู่ในช่วงโจมตีคูลดาวน์ของคำสั่ง Airstrike ในรอบแรกลดลง 20.0% (50.0%)
225,Ikkousen ,เมื่อมี Akagi อยู่ในกองเรือค่าพลังโจมตีทางอากาศของตนเองเพิ่มขึ้น 15.0% (30.0%)
226,Aircraft Carrier Fleet ,ทุกครั้งที่ส่งฝูงเครื่องบินออกไปด้วยคำสั่ง Airstrikeเพิ่มค่าพลังโจมตีปืนใหญ่ให้กับกองเรือแถวหน้าทั้งหมด 5.0% (15.0%)  นาน 8 วินาที
226,Nikkousen ,เมื่อมี Hiryuu อยู่ในกองเรือค่าพลังโจมตีทางอากาศของตนเองเพิ่มขึ้น 15.0% (35.0%)
227,The Last Counter Attack ,เมื่อได้รับความเสียหายที่ทำให้จมจะไม่จม (เหลือค่าพลังชีวิตไว้ 1) และได้รับสถานะหลบหลีกการโจมตีทุกชนิดนาน 5 (15) วินาที พร้อมกับส่งฝูงเครื่องบินพิเศษจากสกิลเข้าจู่โจมศัตรูทันที (ความเสียหายขึ้นอยู่กับเลเวลสกิล)ทุก 1 การต่อสู้จะแสดงผลสกิลนีได้ครั้งเดียวเท่านั้น
227,Nikkousen ,เมื่อมี Soryuu อยู่ในกองเรือค่าพลังโจมตีทางอากาศของตนเองเพิ่มขึ้น 15.0% (35.0%)
228,Gokkousen  ,เมื่อคู่กับ Zuikakuค่าโจมตีทางอากาศเพิ่มขึ้น 12.0% (30.0%) และ ได้รับความเสียหายเพิ่มขึ้น 4.0% (10.0%)
228,Crane's Protection ,หลังคำสั่ง Airstrikeบัฟทั้งกองเรือให้สร้างความเสียหายได้มากขึ้น 4.0% (10.0%) และลดความเสียหายที่ได้รับ 4.0% (10.0%)แสดงผลนาน 12 วินาที
229,Gokkousen  ,เมื่อคู่กับ Shoukakuค่าโจมตีทางอากาศเพิ่มขึ้น 8.0% (20.0%) และ ได้รับความเสียหายลดลง 8.0% (20.0%)
229,Crane's Endeavor ,เมื่อใช้คำสั่ง Airstrikeเพิ่มความเสียหายที่สร้างจากการโจมตีทางอากาศในครั้งถัดไป 8.0% (20.0%)แสดงผลบัฟทับซ้อนได้สูงสุด 3 ครั้ง
252,Wings of Iron Blood ,ลดความเสียหายที่ได้รับจากเรือฝ่าย Iron Blood (เรือเยอรมัน) ลง 5.0% (15.0%)
252,Eagle of Iron Blood ,เมื่อใช้เครื่องบินฝ่าย Iron Blood (เครื่องบินเยอรมัน) (BF-109TME-155AJu-87C) จะเพิ่มประสิทธิภาพเครื่องบินดังกล่าวมากขึ้น 15.0% (30.0%).
